{"exit_status":0,"findings":[],"findings_total":0,"findings_truncated":false,"git":{"branch":"main","commit":"92552053c361cdcc629ed88dc44bc3a6e55510d3","dirty":true},"run_id":"arb-ruff-c351c2cb61be4003985427df05f35fb9","schema":"gzkit.arb.lint_receipt.v1","timestamp_utc":"2026-04-20T22:58:27Z","tool":{"name":"ruff","version":"ruff 0.15.11"}}
