{"exit_status":0,"findings":[],"findings_total":0,"findings_truncated":false,"git":{"branch":"main","commit":"0e580bd249f970f08f37f63fd880d15bac5a54a5","dirty":true},"run_id":"arb-ruff-f088e45f391549bfa3a613107bf4955a","schema":"gzkit.arb.lint_receipt.v1","timestamp_utc":"2026-05-02T23:08:05Z","tool":{"name":"ruff","version":"ruff 0.15.12"}}