{"exit_status":1,"findings":[{"column":101,"line":54,"message":"Line too long (111 > 100)","path":"/Users/jeff/Documents/Code/gzkit/features/steps/advisor_timeout_steps.py","rule":"E501"}],"findings_total":1,"findings_truncated":false,"git":{"branch":"main","commit":"259e4eb0d56a70c791da1f5816b30a5a32bb0445","dirty":true},"run_id":"arb-ruff-01b2441c99624ae988d2565909a8c587","schema":"gzkit.arb.lint_receipt.v1","timestamp_utc":"2026-05-07T01:10:40Z","tool":{"name":"ruff","version":"ruff 0.15.12"}}
