{"exit_status":1,"findings":[{"column":101,"line":265,"message":"Line too long (101 > 100)","path":"/Users/jeff/Documents/Code/gzkit/src/gzkit/cli/parser_artifacts.py","rule":"E501"}],"findings_total":1,"findings_truncated":false,"git":{"branch":"main","commit":"159f8f5371fd0062bc3055b76bcb16ce8d9d5305","dirty":true},"run_id":"arb-ruff-58201cbeae6b4548977c518027c82b29","schema":"gzkit.arb.lint_receipt.v1","timestamp_utc":"2026-05-08T01:17:43Z","tool":{"name":"ruff","version":"ruff 0.15.12"}}
