{"exit_status":1,"findings":[{"column":101,"line":49,"message":"Line too long (102 > 100)","path":"/Users/jeff/Documents/Code/gzkit/src/gzkit/justify/walkthrough.py","rule":"E501"},{"column":8,"line":13,"message":"`sys` imported but unused","path":"/Users/jeff/Documents/Code/gzkit/tests/commands/test_justify_cmd.py","rule":"F401"},{"column":1,"line":8,"message":"Import block is un-sorted or un-formatted","path":"/Users/jeff/Documents/Code/gzkit/tests/justify/test_walkthrough.py","rule":"I001"},{"column":101,"line":41,"message":"Line too long (125 > 100)","path":"/Users/jeff/Documents/Code/gzkit/tests/justify/test_walkthrough.py","rule":"E501"},{"column":101,"line":66,"message":"Line too long (125 > 100)","path":"/Users/jeff/Documents/Code/gzkit/tests/justify/test_walkthrough.py","rule":"E501"},{"column":101,"line":70,"message":"Line too long (147 > 100)","path":"/Users/jeff/Documents/Code/gzkit/tests/justify/test_walkthrough.py","rule":"E501"},{"column":101,"line":75,"message":"Line too long (119 > 100)","path":"/Users/jeff/Documents/Code/gzkit/tests/justify/test_walkthrough.py","rule":"E501"},{"column":101,"line":322,"message":"Line too long (103 > 100)","path":"/Users/jeff/Documents/Code/gzkit/tests/justify/test_walkthrough.py","rule":"E501"}],"findings_total":8,"findings_truncated":false,"git":{"branch":"main","commit":"440e54191bbbd74fe242354c34e401bb28db0958","dirty":true},"run_id":"arb-ruff-6dd7db1206844731bc65cd7e19f5581e","schema":"gzkit.arb.lint_receipt.v1","timestamp_utc":"2026-04-22T07:31:06Z","tool":{"name":"ruff","version":"ruff 0.15.11"}}
