{"exit_status":0,"findings":[],"findings_total":0,"findings_truncated":false,"git":{"branch":"main","commit":"95b27272f6f4fcadfb7926cc468119b7a6f43b42","dirty":true},"run_id":"arb-ruff-e27c2f060790479d8754750e5fb1cd28","schema":"gzkit.arb.lint_receipt.v1","timestamp_utc":"2026-04-26T01:29:12Z","tool":{"name":"ruff","version":"ruff 0.15.11"}}
