{"exit_status":0,"findings":[],"findings_total":0,"findings_truncated":false,"git":{"branch":"main","commit":"9226d3e7beea83fc7b19d6f4b3fe0b1ce87b0658","dirty":true},"run_id":"arb-ruff-b912f19a1c024e3cbcc32e3a8e7767ee","schema":"gzkit.arb.lint_receipt.v1","timestamp_utc":"2026-04-18T11:32:44Z","tool":{"name":"ruff","version":"ruff 0.15.11"}}
