{"exit_status":0,"findings":[],"findings_total":0,"findings_truncated":false,"git":{"branch":"main","commit":"9662a8704e7fa0e1d4116aaf7028644f7a2ad601","dirty":true},"run_id":"arb-ruff-d116abb155664a0591f9f8996d6866c8","schema":"gzkit.arb.lint_receipt.v1","timestamp_utc":"2026-04-29T08:04:32Z","tool":{"name":"ruff","version":"ruff 0.15.11"}}
