{"exit_status":0,"findings":[],"findings_total":0,"findings_truncated":false,"git":{"branch":"main","commit":"45afc7c849c41cc38d98966b618ac1dd2d593981","dirty":true},"run_id":"arb-ruff-ed89979944e749d68dfa93739dbfd67f","schema":"gzkit.arb.lint_receipt.v1","timestamp_utc":"2026-05-03T00:56:16Z","tool":{"name":"ruff","version":"ruff 0.15.12"}}
