{"exit_status":0,"findings":[],"findings_total":0,"findings_truncated":false,"git":{"branch":"main","commit":"65c530e9634f0476b182fe48c1c1e035aab188eb","dirty":true},"run_id":"arb-ruff-1877b547d779490abd9f40f7036d681a","schema":"gzkit.arb.lint_receipt.v1","timestamp_utc":"2026-05-02T12:38:04Z","tool":{"name":"ruff","version":"ruff 0.15.11"}}
