{"exit_status":0,"findings":[],"findings_total":0,"findings_truncated":false,"git":{"branch":"main","commit":"b59752fb4536c3aaf03f0e9dd38d47d1d52f8594","dirty":true},"run_id":"arb-ruff-d2ef77b772234bd6adc42eeb735e4e23","schema":"gzkit.arb.lint_receipt.v1","timestamp_utc":"2026-05-05T01:56:54Z","tool":{"name":"ruff","version":"ruff 0.15.12"}}
