{"exit_status":0,"findings":[],"findings_total":0,"findings_truncated":false,"git":{"branch":"main","commit":"a564984e1451bc81effad1c5bd7293167871179a","dirty":true},"run_id":"arb-ruff-ea49a20864a040bd91f641190bb8c093","schema":"gzkit.arb.lint_receipt.v1","timestamp_utc":"2026-05-02T20:28:09Z","tool":{"name":"ruff","version":"ruff 0.15.12"}}