{"exit_status":1,"findings":[{"column":14,"line":100,"message":"Use a context manager for opening files","path":"/Users/jeff/Documents/Code/gzkit/tests/complexity/test_thresholds.py","rule":"SIM115"}],"findings_total":1,"findings_truncated":false,"git":{"branch":"main","commit":"893bb3c6819f977df6df3f84f7d0758ced5793e0","dirty":true},"run_id":"arb-ruff-737ff80bed20464f97d8386b0401239f","schema":"gzkit.arb.lint_receipt.v1","timestamp_utc":"2026-05-06T00:04:00Z","tool":{"name":"ruff","version":"ruff 0.15.12"}}
