{"exit_status":0,"findings":[],"findings_total":0,"findings_truncated":false,"git":{"branch":"main","commit":"fa747deb1f70c93ee1c5300cca8491153fc19cb7","dirty":true},"run_id":"arb-ruff-c302714dfa9b48cbbacd0d2bce8b6aa2","schema":"gzkit.arb.lint_receipt.v1","timestamp_utc":"2026-04-30T09:13:49Z","tool":{"name":"ruff","version":"ruff 0.15.11"}}
