{"exit_status":0,"findings":[],"findings_total":0,"findings_truncated":false,"git":{"branch":"main","commit":"440e54191bbbd74fe242354c34e401bb28db0958","dirty":true},"run_id":"arb-ruff-81edbbafe2bf40e0ac49497b4ab0ab22","schema":"gzkit.arb.lint_receipt.v1","timestamp_utc":"2026-04-22T07:37:21Z","tool":{"name":"ruff","version":"ruff 0.15.11"}}
